{
  "spec_version": "v1.5.5",
  "card_id": "TEST-001",
  "run_id": "20260116_212210_ef53",
  "created_at": "2026-01-16T21:22:10.235260",
  "overall_status": "NOT_RUN",
  "placeholder": true,
  "validators": [
    {
      "validator_id": "syntax_check",
      "name": "Syntax Check",
      "status": "NOT_RUN",
      "message": "Validator not implemented yet",
      "duration_seconds": null,
      "artifacts": [],
      "placeholder": true
    },
    {
      "validator_id": "type_check",
      "name": "Type Check",
      "status": "NOT_RUN",
      "message": "Validator not implemented yet",
      "duration_seconds": null,
      "artifacts": [],
      "placeholder": true
    },
    {
      "validator_id": "test_runner",
      "name": "Test Runner",
      "status": "NOT_RUN",
      "message": "Validator not implemented yet",
      "duration_seconds": null,
      "artifacts": [],
      "placeholder": true
    },
    {
      "validator_id": "lint_check",
      "name": "Lint Check",
      "status": "NOT_RUN",
      "message": "Validator not implemented yet",
      "duration_seconds": null,
      "artifacts": [],
      "placeholder": true
    }
  ],
  "summary": {
    "total": 4,
    "passed": 0,
    "failed": 0,
    "not_run": 4
  }
}